{
  "$schema": "../schemas/indicators.schema.json",
  "formatVersion": 1,
  "layer": "remote",
  "revision": 3,
  "indicators": [
    {
      "canonicalKey": "tumor_afp",
      "displayName": "甲胎蛋白",
      "categoryKey": "laboratory_other",
      "order": 20,
      "kind": "quantitative",
      "valueType": "numeric",
      "specimen": "serum",
      "defaultUnit": "ng/mL",
      "unitDimension": "mass_concentration",
      "aliases": [
        "AFP",
        "甲胎蛋白",
        "甲胎蛋白测定",
        "甲胎蛋白AFP",
        "甲胎蛋白(AFP)(发光法-定量)"
      ],
      "allowedUnits": [
        "ng/mL",
        "μg/L"
      ],
      "sectionHints": [
        "肿瘤标志物",
        "多肿瘤标志物联合检测"
      ],
      "explanation": "原报告中的甲胎蛋白检测结果，应结合本次报告参考范围观察。"
    },
    {
      "canonicalKey": "tumor_cea",
      "displayName": "癌胚抗原",
      "categoryKey": "laboratory_other",
      "order": 21,
      "kind": "quantitative",
      "valueType": "numeric",
      "specimen": "serum",
      "defaultUnit": "ng/mL",
      "unitDimension": "mass_concentration",
      "aliases": [
        "CEA",
        "癌胚抗原",
        "癌胚抗原测定",
        "癌胚抗原CEA",
        "癌胚抗原(CEA)(发光法-定量)"
      ],
      "allowedUnits": [
        "ng/mL",
        "μg/L"
      ],
      "sectionHints": [
        "肿瘤标志物",
        "多肿瘤标志物联合检测"
      ],
      "explanation": "原报告中的癌胚抗原检测结果，应结合本次报告参考范围观察。"
    },
    {
      "canonicalKey": "tumor_ca19_9",
      "displayName": "糖类抗原 19-9",
      "categoryKey": "laboratory_other",
      "order": 22,
      "kind": "quantitative",
      "valueType": "numeric",
      "specimen": "serum",
      "defaultUnit": "U/mL",
      "unitDimension": "other",
      "aliases": [
        "CA19-9",
        "CA199",
        "糖类抗原19-9",
        "糖类抗原19-9测定",
        "糖类抗原19-9测定(CA19-9)"
      ],
      "allowedUnits": [
        "U/mL",
        "kU/L"
      ],
      "sectionHints": [
        "肿瘤标志物",
        "多肿瘤标志物联合检测"
      ],
      "explanation": "原报告中的糖类抗原 19-9 检测结果，应结合本次报告参考范围观察。"
    },
    {
      "canonicalKey": "tumor_ca15_3",
      "displayName": "糖类抗原 15-3",
      "categoryKey": "laboratory_other",
      "order": 23,
      "kind": "quantitative",
      "valueType": "numeric",
      "specimen": "serum",
      "defaultUnit": "U/mL",
      "unitDimension": "other",
      "aliases": [
        "CA15-3",
        "CA153",
        "糖类抗原15-3",
        "糖类抗原15-3测定",
        "糖类抗原15-3测定(CA15-3)"
      ],
      "allowedUnits": [
        "U/mL",
        "kU/L"
      ],
      "sectionHints": [
        "肿瘤标志物",
        "多肿瘤标志物联合检测"
      ],
      "explanation": "原报告中的糖类抗原 15-3 检测结果，应结合本次报告参考范围观察。"
    },
    {
      "canonicalKey": "tumor_ca242",
      "displayName": "糖类抗原 242",
      "categoryKey": "laboratory_other",
      "order": 24,
      "kind": "quantitative",
      "valueType": "numeric",
      "specimen": "serum",
      "defaultUnit": "U/mL",
      "unitDimension": "other",
      "aliases": [
        "CA242",
        "糖类抗原242",
        "糖类抗原242测定",
        "糖类抗原242测定(CA242)"
      ],
      "allowedUnits": [
        "U/mL",
        "kU/L"
      ],
      "sectionHints": [
        "肿瘤标志物",
        "多肿瘤标志物联合检测"
      ],
      "explanation": "原报告中的糖类抗原 242 检测结果，应结合本次报告参考范围观察。"
    },
    {
      "canonicalKey": "tumor_ca50",
      "displayName": "糖类抗原 50",
      "categoryKey": "laboratory_other",
      "order": 25,
      "kind": "quantitative",
      "valueType": "numeric",
      "specimen": "serum",
      "defaultUnit": "U/mL",
      "unitDimension": "other",
      "aliases": [
        "CA50",
        "糖类抗原50",
        "糖类抗原50测定",
        "糖类抗原50测定(CA50)"
      ],
      "allowedUnits": [
        "U/mL",
        "kU/L"
      ],
      "sectionHints": [
        "肿瘤标志物",
        "多肿瘤标志物联合检测"
      ],
      "explanation": "原报告中的糖类抗原 50 检测结果，应结合本次报告参考范围观察。"
    },
    {
      "canonicalKey": "tumor_nse",
      "displayName": "神经元特异性烯醇化酶",
      "categoryKey": "laboratory_other",
      "order": 26,
      "kind": "quantitative",
      "valueType": "numeric",
      "specimen": "serum",
      "defaultUnit": "ng/mL",
      "unitDimension": "mass_concentration",
      "aliases": [
        "NSE",
        "神经元特异性烯醇化酶",
        "神经元特异性烯醇化酶测定"
      ],
      "allowedUnits": [
        "ng/mL",
        "μg/L"
      ],
      "sectionHints": [
        "肿瘤标志物",
        "多肿瘤标志物联合检测"
      ],
      "explanation": "原报告中的神经元特异性烯醇化酶检测结果，应结合本次报告参考范围观察。"
    },
    {
      "canonicalKey": "tumor_ca72_4",
      "displayName": "糖类抗原 72-4",
      "categoryKey": "laboratory_other",
      "order": 27,
      "kind": "quantitative",
      "valueType": "numeric",
      "specimen": "serum",
      "defaultUnit": "U/mL",
      "unitDimension": "other",
      "aliases": [
        "CA72-4",
        "CA724",
        "糖类抗原72-4",
        "糖类抗原72-4测定",
        "糖类抗原72-4测定(CA72-4)"
      ],
      "allowedUnits": [
        "U/mL",
        "kU/L"
      ],
      "sectionHints": [
        "肿瘤标志物",
        "多肿瘤标志物联合检测"
      ],
      "explanation": "原报告中的糖类抗原 72-4 检测结果，应结合本次报告参考范围观察。"
    },
    {
      "canonicalKey": "tumor_cyfra21_1",
      "displayName": "细胞角蛋白 19 片段",
      "categoryKey": "laboratory_other",
      "order": 28,
      "kind": "quantitative",
      "valueType": "numeric",
      "specimen": "serum",
      "defaultUnit": "ng/mL",
      "unitDimension": "mass_concentration",
      "aliases": [
        "CYFRA21-1",
        "CYFRA211",
        "细胞角蛋白19片段",
        "细胞角蛋白19片段测定"
      ],
      "allowedUnits": [
        "ng/mL",
        "μg/L"
      ],
      "sectionHints": [
        "肿瘤标志物",
        "多肿瘤标志物联合检测"
      ],
      "explanation": "原报告中的细胞角蛋白 19 片段检测结果，应结合本次报告参考范围观察。"
    },
    {
      "canonicalKey": "thyroid_tpo_antibody",
      "displayName": "抗甲状腺过氧化物酶抗体",
      "categoryKey": "thyroid_function",
      "order": 33,
      "kind": "quantitative",
      "valueType": "numeric",
      "specimen": "serum",
      "defaultUnit": "IU/mL",
      "unitDimension": "other",
      "aliases": [
        "抗甲状腺过氧化物酶抗体",
        "甲状腺过氧化物酶抗体",
        "抗甲状腺过氧化酶抗体",
        "TPOAb",
        "Anti-TPO",
        "Anti-thyroid peroxidase antibody",
        "Thyroid peroxidase antibody"
      ],
      "allowedUnits": [
        "IU/mL"
      ],
      "sectionHints": [
        "甲状腺功能",
        "甲功",
        "甲状腺抗体"
      ],
      "explanation": "甲状腺过氧化物酶相关抗体检测项目，应结合本次报告参考范围观察。"
    },
    {
      "canonicalKey": "thyroid_thyroglobulin_antibody",
      "displayName": "抗甲状腺球蛋白抗体",
      "categoryKey": "thyroid_function",
      "order": 34,
      "kind": "quantitative",
      "valueType": "numeric",
      "specimen": "serum",
      "defaultUnit": "IU/mL",
      "unitDimension": "other",
      "aliases": [
        "抗甲状腺球蛋白抗体",
        "甲状腺球蛋白抗体",
        "TgAb",
        "Anti-Tg",
        "Anti-thyroglobulin antibody",
        "Thyroglobulin antibody"
      ],
      "allowedUnits": [
        "IU/mL"
      ],
      "sectionHints": [
        "甲状腺功能",
        "甲功",
        "甲状腺抗体"
      ],
      "explanation": "甲状腺球蛋白相关抗体检测项目，应结合本次报告参考范围观察。"
    },
    {
      "canonicalKey": "thyroid_tsh_receptor_antibody",
      "displayName": "促甲状腺激素受体抗体",
      "categoryKey": "thyroid_function",
      "order": 35,
      "kind": "quantitative",
      "valueType": "numeric",
      "specimen": "serum",
      "defaultUnit": "U/L",
      "unitDimension": "other",
      "aliases": [
        "促甲状腺激素受体抗体",
        "促甲状腺素受体抗体",
        "甲状腺刺激激素受体抗体",
        "TRAb",
        "TSHR-Ab",
        "Anti-TSH receptor antibody",
        "Thyrotropin receptor antibody"
      ],
      "allowedUnits": [
        "U/L"
      ],
      "sectionHints": [
        "甲状腺功能",
        "甲功",
        "甲状腺抗体"
      ],
      "explanation": "促甲状腺激素受体相关抗体检测项目，应结合本次报告参考范围观察。"
    }
  ],
  "extensions": [],
  "redirects": {}
}
